<?xml version="1.0" encoding="utf8"?>
<?xml-stylesheet type="text/xsl" href="../../xslt/jadepunk_html.xsl"?>
<!DOCTYPE character SYSTEM "Jadepunk/character.dtd">
<character>
  <id>
    <charname>Johannes van Coevorden</charname>
    <playername>Kevin Baird</playername>
    <story>&#160;</story>
  </id>
  <refresh base="7"/>
  <aspects>
    <aspect type="Portrayal">&#160;</aspect>
    <aspect type="Background">Envoy for a Nottilan Commercial Concern</aspect>
    <aspect type="Inciting-Incident">&#160;</aspect>
    <aspect type="Belief">I'm Sure We Can Come to a Mutually Beneficial Understanding</aspect>
    <aspect type="Trouble">&#160;</aspect>
  </aspects>
  <professions>
    <profession rating="3" name="Aristocrat"/>
    <profession rating="1" name="Engineer"/>
    <profession rating="1" name="Explorer"/>
    <profession rating="0" name="Fighter"/>
    <profession rating="2" name="Scholar"/>
    <profession rating="2" name="Scoundrel"/>
  </professions>
  <assets>
    <asset name="Cutting Remarks" guiding-aspect="Background" type="Technique">
      <features>
        <feature type="Exceptional" effect="Target may not check a Stress Box"/>
      </features>
      <flaws>
        <flaw type="Situational" effect="Only for Attacks with Aristocrat"/>
      </flaws>
    </asset>
    <!--
    <asset name="Nottilan East Kausao Company" function="Corporate Family" type="Ally">
      <features>
        <feature type="Professional" bonus="2" main-profession="Aristocrat" other-professions="Scholar"/>
        <feature type="Numerous"     bonus="3"/>
        <feature type="Resilient"    bonus="1"/>
        <feature type="Independent"/>
        <feature type="Sturdy"       bonus="1"/>
      </features>
      <flaws>
        <flaw type="Situational" effect="Only Business Concerns"/>
        <flaw type="Troubling"   effect="At Their Beck and Call"/>
      </flaws>
      <notes>I figure it's quite large, but the Numerous reflects a sub-group available to help at any given time.</notes>
    </asset>
    -->
    <asset name="Let's Make a Deal" guiding-aspect="Belief" type="Technique">
      <features>
        <feature type="Focus" bonus="2" profession="Aristocrat"/>
      </features>
      <flaws>
        <flaw type="Situational" effect="Only to Create Advantages on an NPC who is someone else's boss"/>
      </flaws>
    </asset>
    <!--
    <asset name="Jade Tattoo" function="Blue Jade Tattoo of Detection" type="Device">
      <features>
        <feature bonus="3" type="Focus" profession="Scholar"/>
      </features>
      <flaws>
        <flaw type="Troubling"   effect="Easily Identifiable"/>
        <flaw type="Situational" effect="Scholar can only be used for sensing surroundings"/>
      </flaws>
      <notes>Obvious, like Mike Tyson's face tattoo, and IDs Đức as a 'Browncoat'.</notes>
    </asset>
    <asset name="Knowledge is Power" guiding-aspect="Inciting-Incident" type="Technique">
      <features>
        <feature type="Focus" profession="Scholar" bonus="2"/>
      </features>
      <flaws>
        <flaw type="Situational" effect="Only About Đạinamese, Túyàngan, or Kausaoan History"/>
      </flaws>
    </asset>
    -->
  </assets>
  <consequences/>
</character>
