<?xml version="1.0" encoding="utf8"?>
<?xml-stylesheet type="text/xsl" href="../../xslt/jadepunk_html.xsl"?>
<!DOCTYPE character SYSTEM "../Jadepunk/character.dtd">
<character>
  <id>
    <charname nickname="五明数">Wǔ míng shù</charname>
    <playername>Michael Wood</playername>
    <story>
      An alchemist / brewer of elixirs &amp; concoctions.
      Probably 图样人。Mysteriously employed by [Hawthorne Droneworks],
      which specializes in Jade-powered drones. Why are they
      employing an alchemist?
    </story>
  </id>
  <refresh base="7"/>
  <aspects>
    <aspect type="Portrayal">Túyàngan Alchemist</aspect>
    <aspect type="Background">&#160;</aspect>
    <aspect type="Inciting-Incident">Why is a Droneworks employing an Alchemist?</aspect>
    <aspect type="Belief">There are People Involved</aspect>
    <aspect type="Trouble">&#160;</aspect>
  </aspects>
  <professions>
    <profession rating="3" name="Aristocrat"/>
    <profession rating="2" name="Engineer"/>
    <profession rating="&#160;" name="Explorer"/>
    <profession rating="&#160;" name="Fighter"/>
    <profession rating="&#160;" name="Scholar"/>
    <profession rating="&#160;" name="Scoundrel"/>
  </professions>
  <assets>
    <asset name="Alchemist" guiding-aspect="Portrayal" type="Technique">
      <features>
        <feature type="Focus" profession="Engineer" bonus="2"/>
      </features>
      <flaws>
        <flaw type="Situational" effect="Only when brewing Jade-infused potion Devices"/>
      </flaws>
    </asset>
    <asset name="XXX" guiding-aspect="Inciting-Incident" type="Technique">
      <features>
        <feature type="Flexible" effect="Use Aristocrat instead of Scoundrel"/>
      </features>
      <flaws>
        <flaw type="Situational" effect="When trying to conceal information about Jade research"/>
      </flaws>
    </asset>
  </assets>
  <consequences/>
</character>
